General Area (State),General Area (City),Services Offered,Description,Marked for Cleaning,Distributor Name,Location,Distributor Contact (Phone)
Bihar,Muzaffarpur,Medicines,Medicine name: Tocilizumab ; Notes: Distributor,,Bhawani Drug Distributors,"Ifirst Flooropp Imli Chatti Petrol Pumpkishore Complex,Muzaffarpur,842001",['+916212227209']
Bihar,Muzaffarpur,Hospital Beds,Notes: 4 oxygen beds,True,Noble  Hospital,,['+917256812243']
Bihar,Muzaffarpur,Medicines,Medicine name: Tocilizumab ; Notes: Distributor,,Green Agencies,"Near State Bank Atmline Bazarn.H. 31Purnea ( Bihar ),Purnea,854301",['+919430811127']
Bihar,Muzaffarpur,Medicines,Medicine name: Tocilizumab ; Notes: Distributor,,National Pharma,"Juran Chapraroad No- 4Muzaffarpur,Muzaffarpur,842001",['+916212210474']
Bihar,Muzaffarpur,Medicines,Notes: Distributor,,N B Drug Agencies,"Opp Hotel Panchwatinew Area,Saraiyaganjkali Kothip.S Town Thana,Muzaffarpur,842001",['+919431239301']
